song_writer,song_name,lyrics,song_link
Oscar Hammerstein,Out Of My Dreams Lyrics,"
                    Out of your dreams
And into his arms
You long to fly

You don't need egyptian smelling salts to tell you why
Out of your dreams and into the hush
Of falling shadows
When the mist is low
And stars are breaking through
Then out of your dreams you'll go
Into a dream come true

Make up your mind, make up your mind laurie
Laurie dear
Make up your own, make up your own story, laurie dear

Old pharaoh's daughter won't tell you, what do do
But your heart, whatever it tells you will be true

Out of my dreams and into his arms I long to fly
I will come as evening comes into a waiting sky
Then out of my dreams and into the hush
Of falling shadows
When the mist is low
And starts are breaking through

Then out of my dreams I'll go
Into a dream with you                ",https://www.lyricsfreak.com/o/oscar+hammerstein/ + /o/oscar+hammerstein/out+of+my+dreams_20907456.html
Oscar Hammerstein,People Will Say We're In Love Lyrics,"
                    Why do they think up stories that link my name with yours?
Why do the neighbors gossip all day behind their doors?
I know a way to prove what they say is quite untrue
Here is the gist
A practical list of don'ts fer you

Don't throw bouquets at me
Don't please my folks too much
Don't laugh at my jokes too much
People will say we're in love

Laughs at your jokes-

Don't sigh and gaze at me
Your sighs are so like mine
Your eyes musn't glow like mine
People will say we're in love!

Don't start collecting things
Give me my rose and my glove
Sweetheart, they're suspecting things
People will say we're in love!

Some people claim that you're to blame as much as I
Why do you take the trouble to bake my favorite pie?
Grantin' your wish, I carved our initals on that tree
Just keep a slice of all the advice you give so free

Don't praise my charm too much
Don't look so vain with me
Don't stand in the rain with me
People will say we're in love

Don't take my arm too much
Don't keep your hand in mine
Your hand feels so grand in mine
People will say we're in love!

Don't dance all night with me
'Til the stars fade from above
They'll see it's all right with me
People will say we're in love                ",https://www.lyricsfreak.com/o/oscar+hammerstein/ + /o/oscar+hammerstein/people+will+say+were+in+love_20907455.html
Oscar Hammerstein,Poor Jud Is Daid Lyrics,"
                    Poor Jud is daid
Poor Jud Fry is daid
All gather round his coffin now and cry
He had a heart of gold
And he wasn't very old
Oh why did such a fella have to die

Poor Jud is daid
Poor Jud Fry is daid
He's looking oh so peaceful and serene

And serene!

He's all laid down to rest
With his hands across his chest
His fingernails have never looked so clean

And then the preacher'd get up and he'd say: ""Folks, we are gathered
Here to mourn and growl our brother Jud Fry, who hung himself up
By a rope in a smokehouse, and then we have been weepin' and
Wailin' within some of the women. "" And then he'd say: ""Jud was the
Most misunderstood man in the territory. People used to think he was
A mean, ugly fella and they called him a dirty skunk and a northern
Pig stealer.

But the folks that really knowed 'I'm
Knowed that neath those dirty shirts he always wore
There beated a heart as big as all outdoors

As big as all outdoors

Jud Fry loved his fellow man

He loved his fellow man

He loved the birds of the forest
And the bees of the field
He loved the mice and the vermin in the barn
And he treated the rats like equals, which he knew was right!
And he loved the little children
He loved everybody and everything in the world
Only he never let on, so nobody ever noticed

Poor Jud is Daid
Poor Jud Fry is daid
His friends all weep and wail from miles around

Miles around!

The daisies in the dell will give out a different smell
Because poor Jud is underneath the ground

Poor Jud is daid, the candle lights his head
He's layin' in a coffin made of wood

Wood

And folks are feelin' sad cause they used to treat him bad
Now they know their friend has gone for good

Good

Poor Jud is daid, a candle lights his head
He's lookin oh so pretty and so nice
He looks like he's asleep
It's a shame that he won't keep
But it's summer and we're runinng out of ice

Poor Jud... Poor Jud                ",https://www.lyricsfreak.com/o/oscar+hammerstein/ + /o/oscar+hammerstein/poor+jud+is+daid_20907454.html
Oscar Hammerstein,School Song Lyrics,"
                    We work and work
From week to week
At the Royal Bangkok Academy
And English words are all we speak
At the Royal Bangkok... 
[Anna interrupts then starts them over]
From week to week
At the Royal Bangkok Academy
And English words
Are all we speak
At the Royal Bangkok Academy
If we pay attention to our teacher
And obey her every rule, 
We'll be grateful for
Those golden years
At our dear old school.
The Royal Bangkok Academy, 
Our dear old school.                ",https://www.lyricsfreak.com/o/oscar+hammerstein/ + /o/oscar+hammerstein/school+song_20907453.html
Oscar Hammerstein,Shall I Tell You What I Think Of You? Lyrics,"
                    Your servant! Your servant!
Indeed I'm not your servant --
Although you give me less than servant's pay --
I'm a free and independent employe
[Pronounced ""employay""]... (sigh) employee.

Because I'm a woman
You think, like ev'ry woman
I have to be a slave or concubine.
You conceited, self-indulgent libertine!... (sigh)
Libertine! [pronounced ""liberteen""]

How I wished I called him that!
Right to his face! Libertine!
And while we're on the subject, sire,
There are certain goings on around this place
That I wish to tell you I do not admire:
I do not like polygamy
Or even moderate bigamy
I realize
That in your eyes
That clearly makes a prig o' me.

But I am from a civilized land called Wales!
Where men like you are locked in county jails!
In your pursuit of pleasure, you
Have mistresses who treasure you

They have no ken of other men
Beside whom they can measure you

A flock of sheep and you're the only ram
No wonder you're the wonder of Siam!

[Spoken] I'm rather glad I didn't say that...
Not with the women right there... And the children

[Singing] The children, the children,
I'll not forget the children,
No matter where I go I'll always see
Those little faces looking up at me...

At first, when I started to teach,
They were shy and remained out of reach,
But lately I've thought
One or two have been caught
By a word I have said
Or a sentence I've read
And I've heard an occasional question
That implied, at least, a suggestion
That the work I've been trying to do
Was beginning to show with a few...

That Prince Chululongkorn
Is very like his father.
He's stubborn-but inquistitive and smart...
I must leave this place before they break my heart
I must leave this place before they break my heart!

Goodness! I had no idea it was so late.

Shall It tell you what I think of you?
You're spoiled!
You're a conscientious worker
But your spoiled.
Giving credit where it's due
There is much I like in you
But it's also very true
That your spoiled!
Everybody's always bowing to the King
Everybody has to grovel to the King.
By your Buddha you are blessed
By your ladies you're caressed,
But the one who loves you best is the King.

All that bowing and kow-towing
To remind you of your royalty,
I find a most disgusting exhibition.
I wouldn't ask a Siamese cat
To demonstrate his loyalty
By taking this ridiculous position
How would you like it if you were a man
Playing the part of a toad.
Crawling around on your elbows and knees.
Eating the dust of the road!...

Toads! Toads! All of your people are toads!
Yes, Your Majesty;
No, Your Majesty.
Tell us how low to go, Your Majesty;
Make some more decrees, Your Majesty,
Don't let us up off out knees, Your Majesty.
Give us a kick, if you please Your Majesty
Give us a kick, if you would, Your Majesty
Oh, That was good, Your Majesty!                ",https://www.lyricsfreak.com/o/oscar+hammerstein/ + /o/oscar+hammerstein/shall+i+tell+you+what+i+think+of+you_20907452.html
Oscar Hammerstein,Shall We Dance Lyrics,"
                    (Anna sings)
We've just been introduced
I do not know you well
But when the music started something drew me to your side
So many men and girls are in each others arms
It made me think we might be similarly occupied

Shall we dance, on a bright cloud of music
Shall we fly
Shall we dance
Shall we then say goodnight and mean goodbye
Or per chance, when the last little star has left the sky
Shall we still be together with our arms about each other
And shall you be my new romance
On the clear understanding that this kind of thing can happen
Shall we dance, shall we dance, shall we dance

[Interlude:]

Shall we dance, on a bright cloud of music
Shall we fly
Shall we dance
Shall we then say goodnight and mean goodbye

(The King Sings)
Or per chance, when the last little star has leave the sky

(Anna Sings)
Shall we still be together with our arms about each other
And shall you be my new...

(Both Sing)
Romance
On the clear understanding that this kind of thing can happen
Shall we dance, shall we dance, shall we dance                ",https://www.lyricsfreak.com/o/oscar+hammerstein/ + /o/oscar+hammerstein/shall+we+dance_20947015.html
Oscar Hammerstein,Something Wonderful Lyrics,"
                    This is a man who thinks with his heart, 
His heart is not always wise.
This is a man who stumbles and falls, 
But this is a man who tries.

This is a man you'll forgive and forgive, 
And help protect, as long as you live... 
He will not always say
What you would have him say, 
But now and then he'll do
Something
Wonderful.

He has a thousand dreams
That won't come true, 
You know that he believes in them
And that's enough for you.

You'll always go along, 
Defend him when he's wrong
And tell him, when he's strong
He is
Wonderful
He'll always
Needs your love
And so he'll get your love.
A man who needs your love
Can be
Wonderful.

She'll always go along
Defend him when he's wrong
And tell him when he's strong
He is wonderful.
He'll always need her love
And so he'll get her love
A man who needs your love
Can be wonderful.                ",https://www.lyricsfreak.com/o/oscar+hammerstein/ + /o/oscar+hammerstein/something+wonderful_20907451.html
Oscar Hammerstein,Song Of The King Lyrics,"
                    [KING]

A woman is a female who is human, 
Designed for pleasing man, the human male.
A human male is pleased by many women, 
And all the rest you hear is fairy tale.

[ANNA]

Then tell me how this fairy tale bagan, sir.
You cannot call it just a poet's trick
Explain to me why many men are faithful
And true to one wife only.

[KING]

[Spoken] They are sick! 
[Singing] A girl must be like a blossom
With honey for just one man.
A man must be like honey bee
And gather all he can.
To fly from blossom to blossom
A honey bee must be free, 
But blossom must not ever fly
From bee to bee to bee.                ",https://www.lyricsfreak.com/o/oscar+hammerstein/ + /o/oscar+hammerstein/song+of+the+king_20907450.html
Oscar Hammerstein,The Farmer And The Cowman Lyrics,"
                    Oh the farmer and the cowman should be friends
Oh the farmer and the cowman should be friends
One man likes to push a plow
The other likes to chase a cow
But that's no reason why they can't be friends

Territory folks should stick together
Territory folks should all be pals
Cowboys dance with the farmer's daughters
Farmers dance with the rancher's gals

Territory folks should stick together
Territory folks should all be pals
Cowboys dance with the farmer's daughters
Farmers dance with the rancher's gals!

I'd like to say a word for the farmer

Well, say it!

He come out west and made a lot of changes

That's right!

He come out west and built a lot of fences
And built 'em right across our cattle ranges!

Why don't you dirt strangers go back to Missouri Where you belong?

We got just as much right here!

Shut up!
The farmer a good in criticism
No matter what the cowman says or thinks
You seldom see 'I'm drinkin in a bar room

Unless somebody else is buying drinks!

Oh the farmer and the cowman should be friends
Oh the farmer and the cowman should be friends
The cowman ropes a cow with ease
The farmer steals her butter and cheese
That's no reason why they can't be friends

Territory folks should stick together
Territory folks should all be pals
Cowboys dance with the farmer's daughters
Farmers dance with the rancher's gals!

I'd like to say a word for the cowboy

You would!

The road he treads is difficult and stony
He rides fer days on end with just a pony for a friend

I sure am feeling sorry for the pony!

The farmer should be sociable with the cowboy
If he rides by an' asks fer food and water
Don't treat 'I'm like a louse
Make him welcome in your house

But be sure that you've locked up your wife and daughters!

(They all offend themselves at the same time and fight)

Oh the farmer and the cowman should be friends
Oh the farmer and the cowman should be friends
One man likes to push a plow
The other likes to chase a cow
But that's no reason why they can't be friends

Gun shot

Ain't nobody gonna slug anything! This here's a party!
Break it up ya two ol' fools! Alright, Andrew, sing it.
Dum-dah-dee-um-dum-dum

Oh the farmer and the cowman should be friends

Oh the farmer and the cowman should be friends
One man likes to push a plow
The other likes to chase a cow
But that's no reason why they can't be friends

And when this territory is a state
An' joins the Union just like all the others
The farmer, the cowman, and the merchant
Must all behave theirselves and act like brothers

I'll teach you all a little sayin'
And learn the words by heart the way you should
I don't say I'm no better than anybody else
But I'll be danged if I ain't just as good!

I don't say I'm better than anybody else
But I'll be danged if I ain't just as good!

Territory folks should stick together
Territory folks should all be pals
Cowboys dance with the farmer's daughters
Farmers dance with the rancher's gals!                ",https://www.lyricsfreak.com/o/oscar+hammerstein/ + /o/oscar+hammerstein/the+farmer+and+the+cowman_20907449.html
Oscar Hammerstein,The Surrey With The Fringe On Top Lyrics,"
                    When I take you out tonight with me
Honey, here's the way it's gonna be
You will sit behind a team of snow white horses
In the slickest gig you've ever seen

Chicks and ducks and geese better scurry
When I take you out in the surrey
When I take you out in the surrey with the fringe on top
Watch that fringe and see how it flutters
When I drive them high steppen strutters
Nosy pokes will peek through their shutters and their eyes will pop!

The wheels are yellow, the upholstry's brown
The dashboard's genuine leather
With eisenglass curtains you can roll right down
In case there's a change in the weather

Two bright side lights winkin' and blinkin'
Ain't no finer rig I'm a thinkin'
You can keep your rig if you're thinkin that I'd keer to swap
Fer that shiny little surrey with the fringe on the top

Would you say the fringe was made of silk?
Wouldn't have no other kind but silk
Has it really got a team of snow white horses?
One's like snow, the other's more like milk

All the world'll fly in a flurry
When I take you out in the surrey
When I take you out in the surrey with the fringe on top
When we hit that road hell-for-leather
Cats and dogs will dance in the heather
Birds and frogs will sing all together and the toads will hop!
The wind'll whistle as we rattle along
The cows'll moo in the clover
The river will ripple out a whispered song
And whisper over and over
Don't you wish you'd go on forever
Don't you wish you'd go on forever
Don't you wish you'd go on forever
And you'd never stop?
In that shiny little surrey with the fringe on the top

I can see the stars gettin' blurry
When we ride back home in the surrey
Ridin' slowly home on the surrey
With the fringe on top
I can feel the day gettin' older
Feel a sleepy head near my shoulder
Till it falls kerplop

The sun is swimming on the rim of a hill
The moon is taking a header
And just when I'm thinking all the earth is still
A lark'll wake up in the meader

Hush, you bird. My baby's a sleepin'
Maybe got a dream worth a keepin'
Whoa, you team and just keep a creepin'
At a slow clip clop
Don't you hurry little surrey
With the fringe on the top                ",https://www.lyricsfreak.com/o/oscar+hammerstein/ + /o/oscar+hammerstein/the+surrey+with+the+fringe+on+top_20907448.html
Oscar Hammerstein,We Kiss In A Shadow Lyrics,"
                    We kiss in a shadow,
We hide from the moon,
Our meetings are few,
And over too soon.

We speak in a whisper,
Afraid to be heard;
When people are near,
We speak not a word.
Alone in our secret,
Together we sigh,
For one smiling day to be free
To kiss in the sunlight
And say to the sky;
""Behold and believe what you see!
Behold how my lover loves me! ""

[Tuptim]

We speak in a whisper,
Afraid to be heard;
When people are near,

[Lun tha]

We speak not a word.
Alone in our secret,
Together we sigh,
For one smiling day to be free

[Both]

To kiss in the sunlight
And to say to the sky;
""Behold and believe what you see!
Behold how my lover loves me! ""

[Tuptim]

To kiss in the sunlight
And say to the sky;
""Behold and believe what you see!
Behold how my lover loves me! ""                ",https://www.lyricsfreak.com/o/oscar+hammerstein/ + /o/oscar+hammerstein/we+kiss+in+a+shadow_20907447.html
Oscar Hammerstein,Western People Funny Lyrics,"
                    (Thiang)
To prove we're not barbarians
They dress us up like savages!
To prove we're not barbarians
We wear a funny skirt!
Ah... H!

(Wives)
To prove we're not barbarians
They dress us up like savages!
To prove we're not barbarians
We wear a funny skirt!

(Thiang)
Western People Funny,
Western People Funny,
Western People Funny,
Of that there is no doubt,
They feel so sentimental
About the Oriental,
They always try to turn us
Inside down down and upside out!

(Wives)
Upside out and inside down!

(Thiang)
To brusie and pinch our little toes-
Our feet are cramped in leather shoes-
They'd break if we had brittle toes,
But now they only hurt!
Ah... H!

(Wives)
To bruise and pinch our little toes-
Our feet are cramped in leather shoes,
They'd break if we had brittle toes,
But now they only hurt!
Western People Funny!
Western People Funny!
Western People Funny!
Too funny to be true!

(Thiang)
They think they civilise us Ah...
Whenever they advise us
To learn to make the same mistake
That they are making too!
... H!

(All)
They make quite A few!                ",https://www.lyricsfreak.com/o/oscar+hammerstein/ + /o/oscar+hammerstein/western+people+funny_20907457.html
Oscar Hammerstein,You'll Never Walk Alone Lyrics,"
                    (Nettie)
When you walk through a storm
Keep your chin up high
And don't be afraid of the dark

When you walk through a storm
Keep your chin up high
And don't be afraid of the dark
At the end of the storm
Is a golden sky
And the sweet, silver song of the lark

(Chorus sings with Nettie)

Walk on through the wind
Walk on through the rain
Though your dreams be tossed and blown
Walk on, walk on with hope in your heart
And you'll never walk alone
You'll never walk alone                ",https://www.lyricsfreak.com/o/oscar+hammerstein/ + /o/oscar+hammerstein/youll+never+walk+alone_20907459.html
Cole Porter,All Of You Lyrics,"
                    I love the look of you, the lure of you
The sweet of you, the pure of you
The eyes, the arms, the mouth of you
The east, west, north and the south of you

I'd love to gain complete control of you
And handle even the heart and soul of you
So love, at least, a small percent of me, do
For I love all of you

I'd love to gain complete control of you
And handle even the heart and soul of you
So love, at least, a small percent of me, do
For I love all of you, for I love all of you                ",https://www.lyricsfreak.com/c/cole+porter//c/cole+porter/all+of+you_20816177.html
Cole Porter,All Through The Night Lyrics,"
                    The day is my enemy, the night my friend,
For I'm always so alone till the day draws to an end;
But when the sun goes down and the moon comes through,
To the monotone of the evening's drone I'm all alone with you.

All through the night,
I delight in your love,
All through the night you're so close to me!
All through the night,
From a height far above,
You and your love brings me ecstasy!

When dawn comes to waken me,
You're never there at all!
I know you've forsaken me
Till the shadows fall;
But then once again I can dream, I've the right
To be close to you all through the night.                ",https://www.lyricsfreak.com/c/cole+porter//c/cole+porter/all+through+the+night_21150965.html
Cole Porter,Anything Goes Lyrics,"
                    Times have changed,
And we've often rewound the clock,
Since the Puritans got a shock,
When they landed on Plymouth Rock.
If today,
Any shock they should try to stem,
'Stead of landing on Plymouth Rock,
Plymouth Rock would land on them.
In olden days a glimpse of stocking
Was looked on as something shocking,
But now, God knows,
Anything Goes.
Good authors too who once knew better words,
Now only use four letter words
Writing prose, Anything Goes.
The world has gone mad today
And good's bad today,
And black's white today,
And day's night today,
When most guys today
That women prize today
Are just silly gigolos
And though I'm not a great romancer
I know that I'm bound to answer
When you propose,
Anything goes
When grandmama whose age is eighty
In night clubs is getting matey with gigolo's,
Anything Goes.
When mothers pack and leave poor father
Because they decide they'd rather be tennis pros,
Anything Goes.
If driving fast cars you like,
If low bars you like,
If old hymns you like,
If bare limbs you like,
If Mae West you like
Or me undressed you like,
Why, nobody will oppose!
When every night,
The set that's smart
Is intruding in nudist parties in studios,
Anything Goes.
The world has gone mad today
And good's bad today,
And black's white today,
And day's night today,
When most guys today
That women prize today
Are just silly gigolos
And though I'm not a great romancer
I know that I'm bound to answer
When you propose,
Anything goes
If saying your                ",https://www.lyricsfreak.com/c/cole+porter//c/cole+porter/anything+goes_20289240.html
Cole Porter,Begin The Beguine Lyrics,"
                    When they begin the beguine
It brings back the sound of music so tender
It brings back a night of tropical splendor
It brings back a memory ever green
I'm with you once more under the stars
And down by the shore an orchestra's playing
And even the palms seem to be swaying
When they begin the beguine
To live it again is past all endeavor
Except when that tune clutches my heart
And there we are, swearing to love forever
And promising never, never to part
What moments divine, what rapture serene
The clouds came along to disperse the joys we had tasted
And now when I hear people curse the chance that was wasted
I know but too well what they mean
So don't let them begin the beguine
Let the love that was once a fire remain an ember
Let it sleep like the dead desire I only remember
When they begin the beguine
O yes, let them begin the beguine, make them play
Till the stars that were there before return above you
Till you whisper to me once more: ""Darling, I love you!""
And we suddenly know what heaven we're in
When they begin the beguine                ",https://www.lyricsfreak.com/c/cole+porter//c/cole+porter/begin+the+beguine_20153583.html
Cole Porter,"Blow, Gabriel, Blow Lyrics","
                    Brothers and sisters, we are here tonight to fight the devil.
Do you hear that playin'?
Yes I hear that playin'.
Do you know who's playin'?
No who is that playin'?
Why it's Gabriel, Gabriel playin',
Gabriel, Gabriel saying,
Will you be ready to go when I blow my horn?
(Refrain)
Oh blow, Gabriel blow,
Go an' blow, Gabriel blow,
I've been a sinner', I've been a skank
And now I'm willin' to trim my lamp
So blow, Gabriel blow.
I've been low, Gabriel low,
Mighty low, Gabriel low,
But now since I have seen the light
I'm good by day and I'm good by night
So blow, Gabriel blow.
[Verse:]
Once I was headed for hell,
Once I was headed for hell,
But when I got to Satan's door,
I heard you blowin' on your horn once more
So I said ""Satan, farewell.""
And now I'm all ready to fly,
Just to fly higher and higher,
'cause I've been through brimstone,
And I've been through the fire,
And I've perched my soul,
And my heart too,
So climb up the mountain top and start to
Blow, Gabriel blow,
Go on an' blow, Gabriel blow,
I want to join your happy band,
And play all day in the promised land
So blow, Gabriel blow.
Come on you scamps, get up you sinners,
You're all too full of expensive dinners,
Stand up on your lazy feet and sing!
(Refrain)
[Verse:]
(Refrain)                ",https://www.lyricsfreak.com/c/cole+porter//c/cole+porter/blow+gabriel+blow_20157407.html
