song_writer,song_name,lyrics,song_link
Harold Arlen,Ac-Cent-Tchu-Ate The Positive Lyrics,"
                    Gather 'round me, everybody
Gather 'round me, while I preach some
Feel a sermon coming on here
The topic will be sin
And that's what I'm agin'
If you wanna hear my story
Then settle back and just sit tight
While I start reviewing
The attitude of doing right

You got to ac-cent-tchu-ate the positive
E-lim-i-nate the negative
And latch on to the affirmative
Don't mess with mister inbetween

You got to spread joy up to the maximum
Bring gloom down to the minimum
And have faith, or pandemonium
Liable to walk upon the scene

To illustrate my last remark
Jonah in the whale, noah in the ark,
What did they do, just when everything looked so dark?
Man, they said, we better

Ac-cent-tchu-ate the positive
E-lim-i-nate the negative
And latch on to the affirmative
Don't mess with mister inbetween                ",https://www.lyricsfreak.com/h/harold+arlen/ + /h/harold+arlen/ac+cent+tchu+ate+the+positive_20064343.html
Harold Arlen,As Long As I Live Lyrics,"
                    Maybe I can't live to love you as long as I want to.
Life isn't long enough baby, but I can love you as long as I live.

Maybe I can't give you diamonds and things like I want to,
But I can promise you, baby, I'm gonna want to as long as I live.

I never cared, but now I'm scared, I won't live long enough.
That's why I wear my rubbers when it rains and eat an apple every day then see
The doctor anyway.

What if I can't live to love you as long as I want to.
Long as I promise you, baby, I'm gonna love you as long I live.



I'll even wear long underwear, when winter breezes blow
I'm gonna take good care of me because, a sneeze or two might mean the flu,
And that would never never do

What if I can't live to love you as long as I want to.
Long as I promise you, baby, I'm gonna love you as long I live.
Contributed by heelsfans                ",https://www.lyricsfreak.com/h/harold+arlen/ + /h/harold+arlen/as+long+as+i+live_20064331.html
Harold Arlen,Between The Devil And The Deep Blue Sea Lyrics,"
                    I don't want you
But I hate to lose you
You've got me in between
The devil and the deep blue sea
I forgive you
'Cause I can't forget you
You've got me in between
The devil and the deep blue sea
I ought to cross you off my list
But when you come a-knocking at my door
Fate seems to give my heart a twist
And I come running back for more
I should hate you
But I guess I love you
You've got me in between
The devil and the deep blue sea                ",https://www.lyricsfreak.com/h/harold+arlen/ + /h/harold+arlen/between+the+devil+the+deep+blue+sea_20064332.html
Harold Arlen,Blues In The Night Lyrics,"
                    My mama done tol' me, when I was in knee-pants
My mama done tol' me, "" son a woman'll sweet talk""
And
Give ya the big eye, but when the sweet talkin's done
A woman's a two-face, a worrisome thing who'll
Leave ya to sing the blues in the night

Now the rain's a-fallin', hear the train's a-callin,
""whooee!""
(my mama done tol' me) hear dat lonesome whistle blowin' 'cross the trestle, ""whooee!""
(my
Mama done tol' me) a-whooee-ah-whooee ol' clickety-clack's a-echoin' back th' blues in the night
The
Evenin' breeze'll start the trees to cryin' and the moon'll hide it's light when you get the blues in
The night
Take my word, the mockingbird'll sing the saddest kind o' song, he knows things are wrong,
And he's right

From natchez to mobile, from memphis to st. Joe, wherever the four winds blow
I been
In some big towns an' heard me some big talk, but there is one thing I know
A woman's a two-face, a
Worrisome thing who'll leave ya to sing the blues in the night

My mama was right, there's blues in                ",https://www.lyricsfreak.com/h/harold+arlen/ + /h/harold+arlen/blues+in+the+night_10140622.html
Harold Arlen,Come Rain Or Come Shine Lyrics,"
                    I'm gonna love you, like nobody's loved you
Come rain or come shine
High as a mountain, deep as a river
Come rain or come shine
I guess when you met me
It was just one of those things
But don't you ever bet me
'cause I'm gonna be true if you let me
You're gonna love me, like nobody's loved me
Come rain or come shine
We'll be happy together, unhappy together
Now won't that be just fine
The days may be cloudy or sunny
We're in or out of the money
But I'm with you always
I'm with you rain or shine                ",https://www.lyricsfreak.com/h/harold+arlen/ + /h/harold+arlen/come+rain+or+come+shine_20064333.html
Harold Arlen,Ding Dong The Witch Is Dead(From The Wizard Of Oz) Lyrics,"
                    Sung to the tune of ""Ding-Dong The Witch Is Dead"" from Wizard Of Oz

Ding-Dong Saddam was found
Where was he? .... Underground!
Ding dong  wicked Saddam was found
Hi Ho the Merry-o
They searched high, they searched low
Ding dong Saddam Hussein was found

Down in a Spider hole
Below, below, below yo-ho
And now we know

Ding Dong Saddam was caught
He didn't do what he ought
Ding Dong wicked Saddam was caught
Hi Ho the merry-o
Now Bush says ""We told you so..""
Ding dong Saddam Hussein was caught                ",https://www.lyricsfreak.com/h/harold+arlen/ + /h/harold+arlen/ding+dong+the+witch+is+deadfrom+the+wizard+of+oz_20937200.html
Harold Arlen,Ding-Dong! The Witch Is Dead Lyrics,"
                    Ding dong! The witch is dead. Which old witch? The wicked witch!
Ding dong! The wicked witch is dead.
Wake up - sleepy head, rub your eyes, get out of bed.
Wake up, the wicked witch is dead. She's gone where the goblins go,
Below - below - below. Yo-ho, let's open up and sing and ring the bells out.
Ding dong' the merry-oh, sing it high, sing it low.
Let them know
The wicked witch is dead!                ",https://www.lyricsfreak.com/h/harold+arlen/ + /h/harold+arlen/ding+dong+the+witch+is+dead_20064365.html
Harold Arlen,Don't Like Goodbyes Lyrics,"
                    Don't like good-byes, tears or sighs.
I'm not too good at leavin' time.
I got no taste for grievin' time. No, no - not me.

You've been my near ones, always my dear ones.
I never thought that I would find
Another love, a different kind, but it came to be.

Well, if you think I'm tellin' you lies,
Go try your luck and look into her eyes.
But remember, you must remember she's mine,
And my world over head has a clear new shine.

Don't want to leave you, sorry to grieve you.
It's travelin' time and I must move on.
Found the girl to lean upon.
And if I could arrange it,
Oh would I care to change it? Not me!

(musical interlude)

Don't wanna leave you, sorry to grieve you.
It's travelin' time and I must move on.
Found the gal to lean upon.
And if I could arrange it,
Oh would I care to change it? Not me!                ",https://www.lyricsfreak.com/h/harold+arlen/ + /h/harold+arlen/dont+like+goodbyes_20064366.html
Harold Arlen,Down With Love Lyrics,"
                    (Lyrics by E. Y. Harburg/Music by Harold Arlen)
Chappell and Co., Inc., ascap

Down with love the flowers and rice and shoes
Down with love the root of all midnight blues
Down with things that give you that well-known pain
Take that moon wrap it in cellophane

Down with love let's liquidate all it's friends
Moon and June and roses and rainbow's ends
Down with songs that moan about night and day
Down with love yes take it away, away

Away
Far away
Give it back to the birds and bees and the Viennese

Down with eyes romantic and stupid
Down with sighs and down with cupid
Brother let's stuff that dove
Down with love

Down with love let's liquidate all it's friends
The moons the Junes the roses and rainbow's ends
Down with songs that moan about night and day
Down with love yes take it away, away

Far away
So very, very far away
Give it back to the birds and the bees and especially the Viennese

Down with eyes romantic and stupid
Down with sighs and down with cupid
Brother let's stuff that dove
Down with love                ",https://www.lyricsfreak.com/h/harold+arlen/ + /h/harold+arlen/down+with+love_20579200.html
Harold Arlen,For Every Man There's A Woman Lyrics,"
                    For every man there's a woman
For every life there's a plan
And wise men know it was ever so
Since the world began, woman was made for man
Where is she, where is the woman for me?

For every prince there's a princess
For every joe there's a joan
And if you wait, you will find the mate
Born for you alone, happy to be your own
Where is she, where is the woman for me?

Find the one, find the one
Then together you will find the sun

For every heart there's a moment
For every hand, a glove
And for every woman, a man to love



For every heart there's a moment
For every hand, a glove
And for every woman, a man to love
Where is she, where is the one forme?                ",https://www.lyricsfreak.com/h/harold+arlen/ + /h/harold+arlen/for+every+man+theres+a+woman_20064334.html
Harold Arlen,Get Happy Lyrics,"
                    Pack up your troubles and just get happy
Ya better chase all your cares away
Sing hallelujah, c'mon get happy
Get ready for the judgment day

The sun is shinin', c'mon get happy
The lord is waiting to take your hand
Shout hallelujah, c'mon get happy
We're goin' to the promised land

We're headin' 'cross the river
Gonna wash our sins in the tide
It's all so peaceful
On the other side

Forget your troubles and just get happy
Ya better chase all your cares away
Sing hallelujah, c'mon get happy
Get ready for the judgment day

The sun is shinin', c'mon get happy
The lord is waiting to take your hand
Shout hallelujah, c'mon get happy
We're goin' to the promised land

We're headin' 'cross the river
Wash our sins away in the tide
It's all so peaceful
On the other side



We're headin' 'cross the river
Wash our sins away in the tide
It's all so peaceful
On the other side

Forget your troubles and just get happy
Ya better chase your cares away!!
Sing hallelujah, c'mon get happy
Get ready for the judgment day                ",https://www.lyricsfreak.com/h/harold+arlen/ + /h/harold+arlen/get+happy_20064348.html
Harold Arlen,"Get Happy, Song (used In ""9:15 Revue"") Lyrics","
                    Pack up your troubles and just get happy
Ya better chase all your cares away
Sing Hallelujah, c'mon get happy
Get ready for the judgment day

The sun is shinin', c'mon get happy
The Lord is waiting to take your hand
Shout Hallelujah, c'mon get happy
We're goin' to the Promised Land

We're headin' 'cross the river
Gonna wash our sins in the tide
It's all so peaceful
On the other side

Forget your troubles and just get happy
Ya better chase all your cares away
Sing Hallelujah, c'mon get happy
Get ready for the judgment day

The sun is shinin', c'mon get happy
The Lord is waiting to take your hand
Shout Hallelujah, c'mon get happy
We're goin' to the Promised Land

We're headin' 'cross the river
Wash our sins away in the tide
It's all so peaceful
On the other side

We're headin' 'cross the river
Wash our sins away in the tide
It's all so peaceful
On the other side

Forget your troubles and just get happy
Ya better chase your cares away
Sing Hallelujah, c'mon get happy
Get ready for the judgment day                ",https://www.lyricsfreak.com/h/harold+arlen/ + /h/harold+arlen/get+happy+song+used+in+915+revue_21368521.html
Harold Arlen,Happiness Is A Thing Called Joe Lyrics,"
                    It seem like happiness is jus' a thing called joe
He got a smile that make the lilac wanna grow
He got a way that make the angels heave a sigh
When they know little joe's passing by
Sometime the cabin gloomy and the table bare
Soon he kiss me and it's christmas everywhere
Trouble fly away and life is easy go
Does he love me good? That's all I has to know
Seem like happiness is jus' a thing called joe

(repeat above)

Little joe, little joe... Little joe                ",https://www.lyricsfreak.com/h/harold+arlen/ + /h/harold+arlen/happiness+is+a+thing+called+joe_20064367.html
Harold Arlen,Hooray For Love Lyrics,"
                    It's the wonder of the world, it's a rocket to the moon
It gets you high, it gets you low, but once you get that glow...

Here's to my best romance, here's to my worst romance
Here's to my first romance - ages ago
Here's to the boys I've kissed, and to complete the list
Here's to the boys who said ""no!""

Love, love, hooray for love
Who was ever too blase for love
Make this the night for love
If we have to fight, let's fight for love

Some sigh and cry for love
Ah, but in pa-ree they die for love
Some waste away for love
Just the same - hooray for love!



It's the rocket to the moon, with a touch of ""clare de lune""
It gets you high, it gets you low, but once you get that glow...

Some trust to fate for love,
Others have to take off weight for love
Some go berzerk for love
Loafers even go to work for love

Sad songs are sobbed for love
People have their noses bobbed for love
Some say we pay for love
Just the same - hooray for love!                ",https://www.lyricsfreak.com/h/harold+arlen/ + /h/harold+arlen/hooray+for+love_20064369.html
Harold Arlen,I Gotta Right To Sing The Blues Lyrics,"
                    I got a right to sing the blues
I got a right to feel low down
I got a right to hang around
Down around the river

A certain man in this old town
Keeps draggin' my poor heart around
All I see for me
Is misery

I got a right to sing the blues
I got a right to moan and sigh
I got a right to sit and cry
Down around the river

I know the deep blue sea
Will soon be callin' me
It must be love
Say what you choose
I got a right to sing the blues                ",https://www.lyricsfreak.com/h/harold+arlen/ + /h/harold+arlen/i+gotta+right+to+sing+the+blues_20064350.html
Harold Arlen,I've Got The World On A String Lyrics,"
                    I've got the world on a string
I'm sitting on a rainbow
Got the string around my finger
What a world, what a life - I'm in love

I've got a song that I sing
I can make the rain go
Any time I move my finger
Lucky me, can't you see - I'm in love

Life's a wonderful thing
As long as I hold the string
I'd be a silly so-and-so
If I should ever let her go                ",https://www.lyricsfreak.com/h/harold+arlen/ + /h/harold+arlen/ive+got+the+world+on+a+string_20064335.html
Harold Arlen,Ill Wind Lyrics,"
                    Blow I'll wind, blow away
Let me rest today
You're blowin' me no good (no good)

Go I'll wind, go away
Skies are oh so gray
Around my neighborhood, and that's no good

You're only misleadin' the sunshine I'm needin'
Ain't that a shame
It's so hard to keep up with troubles that creep up
From out of nowhere, when love's to blame

So I'll wind, blow away
Let me rest today
You're blowin' me no good (no good)



You're only misleadin' the sunshine I'm needin'
Ain't that a shame
It's so hard to keep up with troubles that creep up
From out of nowhere, when love's to blame

So I'll wind, blow away
Let me rest today
You're blowin' me no good (no good)

Blow, I'll wind, blow.                ",https://www.lyricsfreak.com/h/harold+arlen/ + /h/harold+arlen/ill+wind_10140628.html
Harold Arlen,Ill Wind (You're Blowing Me No Good) Lyrics,"
                    Blow ill wind, blow away
Let me rest today
You're blowin' me no good (no good)
Go ill wind, go away
Skies are oh so gray
around my neighborhood, and that's no good
You're only misleadin' the sunshine I'm needin'
Ain't that a shame
It's so hard to keep up with troubles that creep up
from out of nowhere, when love's to blame
So ill wind, blow away
Let me rest today
You're blowin' me no good (no good)

You're only misleadin' the sunshine I'm needin'
Ain't that a shame
It's so hard to keep up with troubles that creep up
from out of nowhere, when love's to blame
So ill wind, blow away
Let me rest today
You're blowin' me no good (no good)
Blow, ill wind, blow.                ",https://www.lyricsfreak.com/h/harold+arlen/ + /h/harold+arlen/ill+wind+youre+blowing+me+no+good_20949121.html
Harold Arlen,It's Only A Paper Moon Lyrics,"
                    Music by harold arlen.
Lyrics by E. Y. (yip) harburg

I never feel a thing is real
When I'm away from you
Out of your embrace
The world's a temporary parking place

Mmm, mm, mm, mm
A bubble for a minute
Mmm, mm, mm, mm
You smile, the bubble has a rainbow in it

Say, it's only a paper moon
Sailing over a cardboard sea
But it wouldn't be make-believe
If you believed in me

Yes, it's only a canvas sky
Hanging over a muslin tree
But it wouldn't be make-believe
If you believed in me

Without your love
It's a honky-tonk parade
Without your love
It's a melody played in a penny arcade

It's a barnum and bailey world
Just as phony as it can be
But it wouldn't be make-believe
If you believed in me                ",https://www.lyricsfreak.com/h/harold+arlen/ + /h/harold+arlen/its+only+a+paper+moon_20064353.html
Harold Arlen,Kickin' The Gong Around Lyrics,"
                    It was down in chinatown,
All the cokies laid around,
Some were high and some were mighty low;
There were millions on the floor
When a knock came on the door,
And there stood old smoky joe.

He was sweatin', cold and pale,
He was lookin' for his frail,
He was broke and all his junk ran out;
Nobody made a sound,
As he stood and looked around,
And then you hear old smoky shout:

Saying, ""tell me where is minnie?
My poor minnie!
Has she been here,
Kicking the gong around? ""

""if you don't know minnie,
She's tall and skinny,
She gets her pleasure
Kicking the gong around!""

[scat chorus]

""just tell her smoky joe
Was here and had to go.""
And as he departed,
The curtains parted,
And there stood minnie
Kicking the gong around!                ",https://www.lyricsfreak.com/h/harold+arlen/ + /h/harold+arlen/kickin+the+gong+around_20064354.html
Harold Arlen,Last Night When We Were Young Lyrics,"
                    Last night when we were young
Love was a star, a song unsung
Life was so new, so real so right
Ages ago last night

Today the world is old
You flew away and time grew cold
Where is that star that shone so bright
Ages ago last night?

To think that spring had depended
On merely this: a look, a kiss
To think that something so splendid
Could slip away in one little daybreak

So now, let's reminisce
And recollect the sighs and the kisses
The arms that clung

When we were young last night                ",https://www.lyricsfreak.com/h/harold+arlen/ + /h/harold+arlen/last+night+when+we+were+young_20064337.html
Harold Arlen,Let's Fall In Love Lyrics,"
                    We might have been meant for each other
To be or not to be, let our hearts discover
I have a feeling, it's a feeling I'm concealing - I don't know why
It's just a mental, incidental, sentimental - alibi
But I adore you, so strong for you
Why go on stalling, I am falling, love is calling - why be shy
Let's fall in love
Why shouldn't we fall in love
Our hearts are made of it, let's take a chance
Why be afraid of it
Let's close our eyes
And make our own paradise
Little we know of it, still we can try
To make a go of it
We might have been meant for each other
To be or not to be, let our hearts discover
Let's fall in love
Why shouldn't we fall in love
Now is the time for it, while we are young
Let's fall in love                ",https://www.lyricsfreak.com/h/harold+arlen/ + /h/harold+arlen/lets+fall+in+love_20064355.html
Harold Arlen,Let's Take A Walk Around The Block Lyrics,"
                    I never traveled further north than old van courtland park
And never further south than the aquarium
I've seen the charm of jersey city, but first let me remark
I saw it from the empire state solarium

But we've been putting nickels in the postal savings bank
And when those nickels pile up, we can toddle off in swank
And I don't mean an ordinary cook's tour
I mean a cabin de-luxe tour

Someday we'll go places
New lands and new faces
The day we quit punching the clock
The future looks pleasant,
But at present
Let's take a walk around the block.

You're just the companion
I want at grand canyon
For throwing old blades down the rock
The money we have'll go for travel
Meantime, let's walk around the block.

Gangway, we'll begin
When our, ship comes in
I'll sit on your lap
All over the map

To london in may time
To venice in play time
To paris in time for a frock
To boston in bean time
Darling, meantime
Let's take a walk around the block.

[Bridge:]

In winter at christmas,
We'll visit the isthmus
And see how they lock up a lock
And then in caracas, on a jackass,
We'll take a ride around the block.

We'll keep to our promise,
To visit st. Thomas
And then at jamaica we'll dock
The prospect is thrilling,
Still I am willing,
Just now to talk around the block.

Onward, to cathay
Then to mandalay
Boom on to bangkok
P'r'aps vladivostok

We'll send the folks cables
Accumulate labels
Buy souvenirs till we're in hock
But since we are flat in old manhattan
Let's take a walk around the block.                ",https://www.lyricsfreak.com/h/harold+arlen/ + /h/harold+arlen/lets+take+a+walk+around+the+block_20064370.html
Harold Arlen,My Shining Hour Lyrics,"
                    Y shining hour


This moment, this minute
And each second in it
Will leave a glow upon the sky
And as time goes by, it will never die

This will be my shining hour
Calm and happy and bright
In my dreams, your face will flower
Through the darkness of the night

Like the lights of home before me
Or an angel, watching o'er me
This will be my shining hour
'til I'm with you again



(like the lights of home before me)
(or an angel watching o'er me)
This will be my shining hour
'til I'm with you again                ",https://www.lyricsfreak.com/h/harold+arlen/ + /h/harold+arlen/my+shining+hour_20064371.html
Harold Arlen,One For My Baby Lyrics,"
                    It's quarter to three, there's no one in the place
Except you and me
So set 'em' up joe, I got a little story
I think you should know
We're drinking my friend, to the end
Of a brief episode
Make it one for my baby
And one more for the road
I know the routine, put another nickel
In the machine
I feel kind of bad, can't you make the music
Easy and sad
I could tell you a lot, but it's not
In a gentleman's code
Make it one for my baby
And one more for the road
You'd never know it, but buddy I'm a kind of poet
And I've got a lot of things I'd like to say
And if I'm gloomy, please listen to me
Till it's talked away
Well that's how it goes, and joe I know your gettin'
Anxious to close
Thanks for the cheer
I hope you didn't mind
My bending your ear
But this torch that I found, it's gotta be drowned
Or it's gonna explode
Make it one for my baby
And one more for the road                ",https://www.lyricsfreak.com/h/harold+arlen/ + /h/harold+arlen/one+for+my+baby_10140635.html
Harold Arlen,Optimistic Voices Lyrics,"
                    You're out of the woods, you're out of the dark, you're our of the night, 
Step into the sun, step into the light.
Keep straight ahead for the most glorious place on the face of the earth or the 
sky.
Hold onto your breath, hold onto your heart, hold onto your hope,
March up to that gate and bid it open.
",https://www.lyricsfreak.com/h/harold+arlen/ + /h/harold+arlen/optimistic+voices_21368023.html
Harold Arlen,Out Of This World Lyrics,"
                    You're clear out of this world
When I'm looking at you
I hear out of this world
The music that no mortal ever knew

You're right out of a book
The fairy tale I read when I was five
No armored knight out of a book
Was more enchanted by a loralei
Then I

After waiting so long
For the right time
After reaching so long for a star
All at once from long and lonely night time
And despite time, here you are

I cry, ""out of this world""
If you said we were through
So let me fly out of this world
And spend the next eternity or two
With you                ",https://www.lyricsfreak.com/h/harold+arlen/ + /h/harold+arlen/out+of+this+world_20064338.html
Harold Arlen,Over The Rainbow Lyrics,"
                    Somewhere over the rainbow
Way up high
There's a place that I heard of
Once in a lullaby

Somewhere over the rainbow
Skies are blue
And the dreams that you dare to dream
Really do come true

Some day I'll wish upon a star
And wake up where the clouds are far behind me
Where troubles melt like lemon drops
Away above the chimney tops
That's where you'll find me

Somewhere over the rainbow
Bluebirds fly
Birds fly over the rainbow
Why then oh why can't i?

If happy little bluebirds fly
Beyond the rainbow why
Oh why can't i?                ",https://www.lyricsfreak.com/h/harold+arlen/ + /h/harold+arlen/over+the+rainbow_20064359.html
Harold Arlen,Sing My Heart Lyrics,"
                    Go on and sing my heart
You know it's spring my heart
So why not show it?

Pretend you're glad my heart
Although you're sad my heart
He mustn't know it

Remember, love is not an easy game
No two hearts ever beat quite the same

Go on and dance my heart
Our only chance my heart
Is to forget it

Should you despair my heart
He'll know we care my heart
And we'll regret it

If it's to be, we soon shall see
And if it's not to be,
No power on earth can make it so

Pretend it's spring my heart
Go on and sing my heart
For if you sing, he'll never know

(bridge)

Go on and dance my heart
Our only chance my heart
Is to forget it

Should you despair my heart
He'll know we care my heart
And we'll regret it

If it's to be, we soon shall see
And if it's not to be,
No power on earth can make it so

Pretend it's spring my heart
Go on and sing my heart
For if you sing, he'll never know                ",https://www.lyricsfreak.com/h/harold+arlen/ + /h/harold+arlen/sing+my+heart_20064372.html
