song_writer,song_name,lyrics,song_link
Hoagy Carmichael,Judy Lyrics,"
                    If her voice can bring
Every hope of the spring
That's Judy, my Judy

If her eyes say ""yes""
But you're wrong in your guess
That's Judy, my Judy

And if you hear her call
In a soft, southern drawl
""Hi, stranger"", that means danger

If you're smart
Watch your heart
'Cause she'll upset 'most any fella's apple cart

In a hundred ways
You'll be shouting her praise
She'll let ya, she'll get ya

And when she sees you fall
She will tell you, ""that's all
You wretch, ya, you bet ya""

Then you'll know
All the heartaches of a fool just like me

If she seems a saint
But you find that she ain't
That's Judy, sure as you're born

In a hundred ways
You'll be shouting her praise
She'll let ya, she'll get ya

And when she sees you fall
She will tell you, ""that's all
You wretch, ya, you bet ya""

Then you'll know
All the heartaches of a fool just like me, just like me

If she seems a saint
But you find that she ain't
That's Judy, sure as you're born                ",https://www.lyricsfreak.com/h/hoagy+carmichael/ + /h/hoagy+carmichael/judy_21217863.html
Hoagy Carmichael,Lazy River Lyrics,"
                    Up a lazy river by the old mill run
Lazy, lazy river in the noon day sun
Linger awhile in the shade of the tree
Throw away your troubles, dream a dream of me

You know, before your sister was born
This is what your Mama did for a living
Music opened a whole new world to me
No matter how bad I feel, no matter how sad or sick I am
I just touched these keys and poof, like magic
I always seemed to feel better
I've always known you had talent, Bobbie
This piano is for you, Charlie worked hard for it
See God wouldn't have made you suffer so much
If you weren't gonna make up for it later

How happy you can be
Up a lazy river with me

Throw away your troubles, baby
Dream a dream with me

Up a lazy river with me

From the halfway mark

To be a star, a big star
You gotta be talented obviously
You gotta be tenacious, have charisma
But most importantly, you've gotta have it
A great intangible and you've got it all, Bobbie
You're gonna be bigger than Sinatra
I'd settle for a little Jolson Mama, Mama, Mama

Ah ah ah, there are blue skies up above
Forever long as we're in love
We'll be up a lazy river
Up a crazy lazy river
Up a lazy river
I ain't goin' your way
Get out of my way
Up a lazy river with me
",https://www.lyricsfreak.com/h/hoagy+carmichael/ + /h/hoagy+carmichael/lazy+river_21214817.html
Hoagy Carmichael,Little Old Lady Lyrics,"
                    Little old lady passing by
Catching everyone's eye
You have such a charming manner
Sweet and shy

Little old bonnet set in place
And a smile on your face
You're a perfect picture
In your lavender and lace

A little bit of business here
A little bit of business there
Bet that you've been window shopping
All around the square

Little old lady, time for tea
Here's a kiss, two or three
You're just like that little old lady
I hold dear to me                ",https://www.lyricsfreak.com/h/hoagy+carmichael/ + /h/hoagy+carmichael/little+old+lady_21214339.html
Hoagy Carmichael,Moon Country Lyrics,"
                    I long for that moon country
That possum and coon country
That sycamore heaven back south
I’ll lose my mind till I get there

I long for that old country
That good for the soul country
With folk cooking things
That melt in your mouth

Mmm, when my cousin, Cindy Lou
Plays a twilight hymn to you
She makes that old piano
Sound exactly like brand new

I long for that moon country
That’s where I should be
‘Cause that old moon country
Is home to me                ",https://www.lyricsfreak.com/h/hoagy+carmichael/ + /h/hoagy+carmichael/moon+country_20830942.html
Hoagy Carmichael,My Resistance Is Low Lyrics,"
                    You touch my fingertips and my heart is aglow
You bend to kiss my lips and I can't let you go
Maybe I should resist, I'm a fool, I know
But at a time like this, my resistance is low (your resistance is low)

Your eyes have magic, they seem to say
Come closer, come closer, my darlin', come closer
And somehow I can't break away

Can't you see that I wanna be adored
More than you'll ever know
And I'm goin' overboard with a capital ""O""

So don't be persistent
Please keep your distance
You know my resistance is low

(You touch my fingertips and my heart is aglow)
(You bend to kiss my lips and I can't let you go)
Maybe I should resist, I'm a fool, I know (resist me, baby?)
But at a time like this, my resistance is low (I know, I know)

(Your eyes) your eyes (have magic), have magic, (they seem) they seem (to say) to say
They're sayin' come closer, come closer, my darlin', come closer
And somehow I can't break away

Can't you see that I wanna be adored
More than you'll ever know
And I'm goin' overboard with a capital ""O""

So don't be persistent
Baby, keep your distance
You know my resistance is low

(Please keep your distance, you know my resistance is) low, hah                ",https://www.lyricsfreak.com/h/hoagy+carmichael/ + /h/hoagy+carmichael/my+resistance+is+low_21217881.html
Hoagy Carmichael,New Orleans Lyrics,"
                    If you've never seen a quaint old Southern city
Just think of New, think of New Orleans

If you've never seen that town, boy, it's a pity
There's nothing like, nothing like New Orleans

It will remind you old fashioned lace
A glass of wine will greet your smiling face

And if you ever see a black-eyed gal like mine, boy
Oh, then you're right in it, right in New Orleans                ",https://www.lyricsfreak.com/h/hoagy+carmichael/ + /h/hoagy+carmichael/new+orleans_20835993.html
Hoagy Carmichael,Ole Buttermilk Sky Lyrics,"
                    Ole buttermilk sky
I'm a-keeping my eye peeled on you
What's the good word tonight
Are you gonna be mellow tonight?

Ole buttermilk sky
Can't you see my little donkey and me?
We're as happy as a Christmas tree
Headin' for the one I love

I'm gonna pop her the question, that question
Do you, darling do you, do?
It'll be easy, so easy
If I can only bank on you

Ole buttermilk sky
I'm a-tellin' you why, now you know
Keep it in mind tonight
Keep a-brushin' those clouds from sight

Ole buttermilk sky
Dont'cha fail me when I'm needin' you most
Hang a moon above her hitchin' post
Hitch me to the one I love

I'm gonna pop her the question, that question
Do you, darling do you, do?
It'll be easy, so easy
If I can only bank on you

Ole buttermilk sky
I'm a-tellin' you why, now you know
Keep it in mind tonight
Keep a-brushin' those clouds from sight

Ole buttermilk sky
Dont'cha fail me when I'm needin' you most
Hang a moon above her hitchin' post
Hitch me to the one I love

You can, if you try, don't tell me no lie
Will you be mellow and bright tonight, ole buttermilk sky?                ",https://www.lyricsfreak.com/h/hoagy+carmichael/ + /h/hoagy+carmichael/ole+buttermilk+sky_21216157.html
Hoagy Carmichael,One Morning In May Lyrics,"
                    One morning in May, don't forget, dear
That one wonderful day when we met, dear
The world over was blue clover
And hearts carefree and gay

One morning in May, oh, the rapture
Tonight darling, I pray to recapture
Just one hour, just one flower
From love's faded bouquet

Kisses that came with the flame of springtime
Burning your name in my heart
Precious to me like a rosary
Now that we're apart

One morning in May to remember
The love smolders away to an ember
And dreams perish, we'll still cherish
That one, one morning in May

The world over was blue clover
And hearts carefree and gay

One hour, just one flower
From loves faded bouquet

Kisses that came with the flame of springtime
Burning your name in my heart
They're so precious to me like a rosary
Now that we're apart

One morning in May to remember
The love smolders away to an ember
And dreams perish, we'll still cherish
That one, one morning in May                ",https://www.lyricsfreak.com/h/hoagy+carmichael/ + /h/hoagy+carmichael/one+morning+in+may_20831078.html
Hoagy Carmichael,Riverboat Shuffle Lyrics,"
                    Good people, you're invited tonight 
To the riverboat shuffle
Good people, we got rhythm tonight
At the riverboat shuffle
They tell me that slide-pipe tooter is grand
Best in Louisiana
So bring your freighter, come and alligator that band
Mister Hawkins on the tenor
Good people, you'll hear Millenberg Joys
In a special orchestration
Even mama Dinah will be there to strut for the boys
In a room full of noise
She'll teach you to shuffle it right
So, bring your baby
I'll be seeing you at the riverboat shuffle tonight

Good people, you're invited tonight 
To the riverboat shuffle
Good people, we got rhythm tonight
At the riverboat shuffle
They tell me that slide-pipe tooter is grand
Best in Louisiana
Bring your freighter, come and alligator that band
Mister Jordan on the alto
Good people, we got Millenberg Joys
In a special orchestration
Even mama Dinah will be there to strut for the boys
In a room full of noise
She'll teach you to shuffle it right
So, bring your baby
I'll be seeing you at the riverboat shuffle, the riverboat shuffle tonight                ",https://www.lyricsfreak.com/h/hoagy+carmichael/ + /h/hoagy+carmichael/riverboat+shuffle_21216697.html
Hoagy Carmichael,Rockin' Chair Lyrics,"
                    Old rockin' chair's got me
(Old rocking chair got you, father)
Cane by my side
(Your cane by your side)

Fetch me that gin, son
(I ain't got no gin, father)
'Fore I tan your hide
(You're gonna tan my hide)

Can't get from this cabin
(Cabin, joking follow)
Ain't go nowhere
(You ain't goin' nowhere?)

Just sittin' me here grabbin'
(Grabbin')
At the flies 'round my rockin' chair
(Rockin' chair)

Old dear aunt Harriet
(Aunt Harriet)
How long to Heaven she be?
(Heaven she be)

Send me a sweet chariot
(Oh chariot)
For the end of the trouble I see
(My sweet Cherie)

Old rockin' chair gets it
(Rocking chair get it, father)
Judgment Day is almost here
(Judgment Day is here)

Chained to my old
(Sing it pop, sing it)
Rockin' chair
[Incomprehensible]

Old rocking chair got you, father
(Yes, indeed, yes indeed, yes indeed, you got it)
And your cane by your side
(Can't get around no more)

But I ain't got no gin, father
(Well, that's all the sadness)
Oh, you gonna tan my hide, tan my hide
(Yeah, yeah get it)

You can't get from this cabin
(Man, I don't wanna go nowhere)
Oh no, father, but you ain't goin' nowhere
(Aha, aha)

You sittin' here grabbin', you grabbin', you grabbin'
(Grabbin',  grabbin')
The flies 'round the old rockin' chair, rockin' chair

My dear old, aunt Harriet
(Yes son, how long to heaven she be?)
May up in heaven she be
(Yeah, you don't like that)

Oh chariot, oh chariot, chariot, chariot, chariot
(Yeah I got your ride, I got your ride, got every chariot)
Once again in the time of trouble, I've seen
(Yeah, nobody knows the trouble I've seen)

Old rockin' chair get it, rockin' chair get it
(Old rockin' chair get it)
And Judgment Day, oh, Judgment Day
(Judgment)
You sittin' here chained to your rockin' chair                ",https://www.lyricsfreak.com/h/hoagy+carmichael/ + /h/hoagy+carmichael/rockin+chair_20824460.html
Hoagy Carmichael,Skylark Lyrics,"
                    Skylark
Have you anything to say to me
Won't you tell me where my love can be
Is there a meadow in the mist
Where someone's waiting to be kissed

Skylark
Have you seen a valley green with spring
Where my heart can go a-journeying
Over the shadows and the rain
To a blossom covered lane

And in your lonely flight
Haven't you heard the music of the night
Wonderful music, faint as a will o' the wisp
Crazy as a loon
Sad as a gypsy serenading the moon

Skylark
I don't know if you can find these things
But my heart is riding on your wings
So if you see them anywhere
Won't you lead me there

Skylark
I don't know if you can find these things
But my heart is riding on your wings
So if you see them anywhere
Won't you lead me there                ",https://www.lyricsfreak.com/h/hoagy+carmichael/ + /h/hoagy+carmichael/skylark_20803866.html
Hoagy Carmichael,Small Fry Lyrics,"
                    Small fry, sittin' by the pool room
Small fry, should be in the school room
My, my, put down that cigarette
You ain't a-grown up high and mighty yet

Small fry, dancin' for a penny
Small fry, countin' up how many
My, my, just listen here to me
You ain't the biggest catfish in the sea

You practice peckin' all day long to some old radio song
Oh yes, oh yes, oh yes
You better listen to your Maw and someday practice the law
And then you'll be a real success

Small fry, you kissed the neighbor's daughter
Small fry, should stay in shallow water
Seems I should take you 'cross my knee
You ain't the biggest catfish in the sea

You've got your feet all soakin' wet
You'll be the death of me yet
Oh my, oh my, small fry                ",https://www.lyricsfreak.com/h/hoagy+carmichael/ + /h/hoagy+carmichael/small+fry_20833037.html
Hoagy Carmichael,Snowball Lyrics,"
                    Snowball, my honey, don’t you melt away
‘Cause daddy likes those dark brown eyes
Snowball, my honey, smile at me each day
‘Cause daddy likes those dark brown eyes

You’re my only sweetheart, little chocolate bar
I’ll eat you up some day
Your two hands and feet are just as black as tar
But don’t you cry, why, say

The good Lord said, use an apple dumplin’
To make your head, you know it’s really somethin’
Snowball, my honey, don’t you melt away
‘Cause daddy likes those dark brown eyes                ",https://www.lyricsfreak.com/h/hoagy+carmichael/ + /h/hoagy+carmichael/snowball_20831116.html
Hoagy Carmichael,Stardust Lyrics,"
                    Sometimes I wonder why I spend
The lonely nights dreaming of a song
The melody haunts my reverie
And I am once again with you

When our love was new
And each kiss an inspiration
Ah but that was long ago
Now my consolation is in the stardust of a song

Beside the garden wall when stars are bright
You are in my arms
The nightingale tells his fairy tale
Of paradise where roses grew

Though I dream in vain
In my heart it will remain
My stardust melody
The memory of love's refrain                ",https://www.lyricsfreak.com/h/hoagy+carmichael/ + /h/hoagy+carmichael/stardust_20800607.html
Hoagy Carmichael,Sweet Lorraine Lyrics,"
                    Everything is set, skies are blue,
Can't believe it yet, but it's true, 
I'll give you just one guess, 
My sweet Lorraine said ""yes""
Waiting for the time, soon to be, 
When the bells will chime merrily,

(I'm so happy,) when it's raining I don't miss the sun, 
For it's in my sweeties smile,
Just think that I'm the lucky one 
Who will lend her down the aisle
Each night I pray 
That nobody steals her heart away, 
Just can't wait until that happy day,
When I marry sweet Lorraine

Everything is set, skies are blue,
Can't believe it yet, but it's true, 
I'll give you just one guess, 
My sweet Lorraine said ""yes""
Waiting for the time, soon to be, 
When the bells will chime merrily,

(I'm so happy,) when it's raining I don't miss the sun, 
For it's in my sweeties smile,
Just think that I'm the lucky one 
Who will lend her down the aisle
Each night I pray 
That nobody steals her heart away, 
Just can't wait until that happy day,
When I marry sweet Lorraine                ",https://www.lyricsfreak.com/h/hoagy+carmichael/ + /h/hoagy+carmichael/sweet+lorraine_21214941.html
Hoagy Carmichael,The ABA Daba Honeymoon Lyrics,"
                    ""Aba, daba, daba, daba, daba, daba, dab""
Said the Chimpie to the Monk
""Baba, daba, daba, daba, daba, daba, dab""
Said the Monkey to the Chimp
All night long they'd chatter away
All day long they're happy and gay
Swinging and singing in their hunky, tonkey way
""Aba, daba, daba, daba, daba, daba, dab""
Means ""Monk, I love but you""
""Baba, daba, dab,"" in monkey talk
Means ""Chimp, I love you too""
Then the big baboon, one night in June
He married them, and very soon 
They went upon their aba, daba honeymoon

""Aba, daba, daba, daba, daba, daba, dab""
Said the Chimpie to the Monk
""Baba, daba, daba, daba, daba, daba, dab,""
Said the Monkey to the Chimp
All night long they'd chatter away
All day long they're happy and gay
Swinging and singing in their hunky, tonkey way
""Aba, daba, daba, daba, daba, daba, dab""
Means ""Monk, I love but you""
""Baba, daba, dab,"" in monkey talk
Means ""Chimp, I love you too""
Then the big baboon, one night in June
He married them, and very soon 
",https://www.lyricsfreak.com/h/hoagy+carmichael/ + /h/hoagy+carmichael/the+aba+daba+honeymoon_21214697.html
Hoagy Carmichael,The Darktown Strutter's Ball Lyrics,"
                    I'll be down to get you in a taxi, honey
You better be ready about half past eight
Now dearie, don't be late
I want to be there when the band starts playing
Remember when we get there, honey
The two-steps I'm goin' to have 'em all
Goin' to dance out both my shoes
When they play the ""Jelly Roll Blues""
Tomorrow night, at the Darktown Strutter's Ball                ",https://www.lyricsfreak.com/h/hoagy+carmichael/ + /h/hoagy+carmichael/the+darktown+strutters+ball_21216299.html
Hoagy Carmichael,The Golden Rocket Lyrics,"
                    Board!
From old Montana down to Alabam' 
I've been before and I'll travel again
You trifling women can't keep a good man down
You've dealt the cards but you missed the play
So hit the road and be on your way
Gonna board the Golden Rocket and leave this town

I was a good engine a-runnin on time
But baby I'm switchin' to another line
So honey, never hang your single out for me
I'm tired of running on the same old track
Bought a one way ticket and I won't be back
This Golden Rocket is gonna roll my blues away

Hear that lonesome whistle blow
That's your cue and by now you know
That I've got another true love waitin' in Tennessee
This midnight special is burning the rails
So woman don't try to follow my trail
This Golden Rocket is gonna roll my blues away

Hear her thunder on through the night
This Golden Rocket is a-doin' me right
That sunny old southland sure is a part of me
Now from your call-board erase my name
Your fire done went out you done lost your flame
And this Golden Rocket is a-rollin' my blues away

That old conductor he seemed to know 
You've done me wrong I was feeling low 
For he yelled aloud we're over that Dixon Line
The Brakeman started singin' a song 
Said 'You're worried now, but it won't be long'
'This Golden Rocket is leavin' your blues behind'

Then the Porter yelled with his southern drawl, 
'Let's rise and shine.  Good mornin' you all'
And I sprang to my feet to greet the newborn day
When I kissed my baby in the station door
That whistle blew like it never before
On the Golden Rocket that rolled my blues away                ",https://www.lyricsfreak.com/h/hoagy+carmichael/ + /h/hoagy+carmichael/the+golden+rocket_21216301.html
Hoagy Carmichael,The Lamplighter's Serenade Lyrics,"
                    A moment after dark around the park
An old-fashion gent comes parading
Dressed in funny clothes but singing as he goes
The Lamplighter's Serenade

The old boy loves to talk with couples on the walk
But when it's half after love time
He reaches for his sticks and from his bag of tricks
He lights every star in the sky

And if a lady or a beau should answer no
He sprinkles their hearts with his magic
Then he steals away to sing another day
The Lamplighter's Serenade

The old boy loves to talk with the couples on the walk
But when it's half after love time
He reaches for his sticks and from his bag of tricks
He lights every star in the sky

And if a lady or a beau should answer no
He sprinkles their hearts with his magic
Then he steals away to sing another day
The Lamplighter's Serenade
",https://www.lyricsfreak.com/h/hoagy+carmichael/ + /h/hoagy+carmichael/the+lamplighters+serenade_21216155.html
Hoagy Carmichael,The Nearness Of You Lyrics,"
                    It's not the pale moon that excites me
That thrills and delights me, oh no
It's just the nearness of you

It isn't your sweet conversation
That brings this sensation, oh no
It's just the nearness of you

When you're in my arms and I feel you so close to me
All my wildest dreams come true

I need no soft lights to enchant me
If you'll only grant me the right
To hold you ever so tight
And to feel in the night the nearness of you                ",https://www.lyricsfreak.com/h/hoagy+carmichael/ + /h/hoagy+carmichael/the+nearness+of+you_20735307.html
Hoagy Carmichael,The Old Music Master Lyrics,"
                    One night long ago by the light of the moon,
An old music master sat composing a tune,
His spirit was soaring and his heart full of joy,
When right out of nowhere stepped a little colored boy.
You gotta jump it, music master,
You gotta play that rhythm faster,
You're never gonna get it played
On the Happy Cat Hit Parade.
You better tell your friend Beethoven,
And Mister Reginald De Koven
They better do the same as you,
Or they're gonna be corny too.
Long about nineteen seventeen
Jazz'll come upon the scene,
Then about nineteen thirty-five
You'll begin to hear swing,
Boogie Woogie and Jive,
You gotta show that big broadcaster
That you're a solid music master,
And you'll achieve posterity,
That's a bit of advice from me.
The old music master simply sat there amazed,
As wide-eyed and open-mouthed he gazed and he gazed
How can you be certain little boy, tell me how?
Because I was born, my friend,
A hundred years from now.
He hit a chord that rocked the spinet
And disappeared into the infinite,
And up until the present day,
You can take it from me,
He's as right as can be,
Ev'rything has happened that-a-way.                ",https://www.lyricsfreak.com/h/hoagy+carmichael/ + /h/hoagy+carmichael/the+old+music+master_21214285.html
Hoagy Carmichael,The Whiffenpoof Song Lyrics,"
                    To the tables down at Mory's
To the place where Louie dwells
To the dear old Temple bar we love so well
Sing the Whiffenpoofs assembled with their glasses raised on high
And the magic of their singing casts it's spell

Yes, the magic of their singing of the songs we love so well
""Shall I Wasting"" and ""Mavourneen"" and the rest
We will serenade our Louie while life and voice shall last
Then we'll pass and be forgotten with the rest

We're poor little lambs who have lost our way
Baa, baa, baa
We're little black sheep who have gone astray
Baa, baa, baa

Gentleman songsters off on a spree
Doomed from here to eternity
Lord have mercy on such as we
Baa, baa, baa                ",https://www.lyricsfreak.com/h/hoagy+carmichael/ + /h/hoagy+carmichael/the+whiffenpoof+song_21216291.html
Hoagy Carmichael,Two Sleepy People Lyrics,"
                    Here we are
Out of cigarettes
Holding hands and yawning
Look how late it gets

Two sleepy people by dawn's early light
And too much in love to say goodnight

Here we are
In the cozy chair
Pickin' on a wishbone
From the frigid air

Two sleepy people with nothing to say
And too much in love to break away

Do you remember
The nights we used to linger in the hall?
Your father didn't like me at all

Do you remember
The reason why we married in the fall?
To rent this little nest and get a bit of rest

Well, here we are
Just about the same
Foggy little fella
Drowsy little dame

Two sleepy people by dawn's early light
And too much in love to say goodnight

Well, here we are
Just about the same
Foggy little fella
Drowsy little dame

Two sleepy people by dawn's early light
And too much in love to say goodnight                ",https://www.lyricsfreak.com/h/hoagy+carmichael/ + /h/hoagy+carmichael/two+sleepy+people_20330767.html
